{
  "constitution_fingerprint": "b4f1570af852773609bb5a5e35e109c10dc263b24995ddcc8e52fa2961527bcd",
  "created_at": "2026-07-20T09:26:07+00:00",
  "event_ref": "additional-pairs-cross-market-generalization-discovery-v1",
  "event_type": "manual_request",
  "research_state_fingerprint": "16cb1973ce0390d7afd628af31e7816bcf3df2fb698fd09524e0e02d37b2626f",
  "schema_version": "research-trigger-v1",
  "source_policy_version": "research-source-policy-v1",
  "trigger_fingerprint": "045a763176bbbea22991eb9670edb19a327d0838752a548ee5326b449d88fafe",
  "trigger_id": "discovery-trigger-01971e22c52762bd"
}
